{
  "$schema": "./resume.schema.json",
  "name": "Muhammad Hashim",
  "tagline": "Engineering leader, architect, principal, many hats, literally and metaphorically.",
  "identity": ["Riyadh, KSA"],
  "contact": [
    { "label": "mhashim6.me", "href": "https://mhashim6.me" },
    { "label": "github/mhashim6", "href": "https://github.com/mhashim6" },
    { "label": "in/mhashim6", "href": "https://linkedin.com/in/mhashim6" },
    { "label": "blog.mhashim6.me", "href": "https://blog.mhashim6.me" },
    { "label": "msg@mhashim6.me", "href": "mailto:msg@mhashim6.me" },
    { "label": "+966 50 346 9921", "href": "tel:+966503469921" }
  ],
  "experience": [
    {
      "org": "Celfocus",
      "location": "Riyadh",
      "roles": [
        {
          "title": "GenAI Architect / Principal Engineer",
          "location": "Riyadh, KSA",
          "start": "2026-06",
          "end": null,
          "scope": "Own GenAI architecture and engineering practice across Celfocus AI Programs.",
          "outcomes": [
            "Defining reference architectures and adoption frameworks/devtools for GenAI across teams."
          ],
          "tags": ["GenAI", "LLMs", "Architecture", "SDLC", "Agentic Engineering"]
        },
        {
          "title": "Engineering Manager",
          "note": "BE DT PMO",
          "client": "stc",
          "location": "Riyadh, KSA",
          "start": "2025-05",
          "end": "2026-09",
          "scope": "E2E Technical Governance",
          "outcomes": ["Halved the DT Stream's Technical Debt and Architectural Backlog", "New Processes for Architectural Governance and Practices"],
          "tags": ["Architecture & Technical Governance", "QA Governance"]
        },
        {
          "title": "Principal Engineer",
          "location": "Cairo, Egypt",
          "start": "2024-04",
          "end": "2025-05",
          "scope": "Software Engineering Leadership team, Egypt Delivery Center SWE Site Lead",
          "outcomes": [
            "Shipped a career-levelling model, a {{hiring playground}}, drove mentorship.", "Set engineering standards and mentored engineers across the practice."
          ],
          "link": { "label": "hiring playground", "url": "https://github.com/Celfocus-SWE/hiring-playground" },
          "tags": ["Architecture", "Mentorship", "Spring Boot", "NodeJS", "React", "Microservices"]
        }
      ]
    },
    {
      "title": "Software Engineering Lead",
      "org": "Stella Stays",
      "location": "Dubai, UAE",
      "start": "2023-05",
      "end": "2024-04",
      "scope": "Managed an international team of 10 engineers and QA building a hospitality-tech platform.",
      "outcomes": [
        "Created Delivery process, a career-levelling model, TDD/BDD."
      ],
      "tags": ["SDLC", "Mob Programming", "NodeJS", "PostgreSQL", "React", "GraphQL", "Microservices"]
    },
    {
      "title": "Software Engineer II",
      "org": "Instabug",
      "location": "Cairo, Egypt",
      "start": "2022-03",
      "end": "2023-03",
      "scope": "R&D and platform work on the mobile SDK and CI. Worked directly with the CTO and CFO",
      "outcomes": [
        "Cut yearly CI/CD tooling costs; authored internal JSON-API & DB-layer specs; lead the Android Studio plugin."
      ],
      "tags": ["Reverse Engineering", "Android", "CI/CD", "Kotlin", "R&D"]
    },
    {
      "org": "Egyptian Armed Forces",
      "location": "Egypt",
      "roles": [
        {
          "title": "Digitalisation Technology Consultant",
          "location": "Egypt",
          "start": "2022-05",
          "end": "2023-05",
          "scope": "Architecture and Development",
          "outcomes": ["Delivered a national travel-permits system."]
        },
        {
          "title": "Corporal · Senior Full-Stack Engineer",
          "location": "Egypt",
          "start": "2021-03",
          "end": "2022-03",
          "scope": "Led 6 engineers building internal telecom & comms systems.",
          "outcomes": [
            "Shipped an SMS gateway, e-fax, and VoIP IVR on a Proxmox / pfSense stack."
          ],
          "tags": ["Kotlin", "Ktor", "Oracle", "VoIP", "Proxmox"]
        }
      ]
    }
  ],
  "earlier": [
    {
      "name": "ElCoach",
      "roleLabel": "Software Engineer",
      "period": "2020 — 2022",
      "summary": "Unified React-Native API for Apple Health & Google Fit; Huawei ecosystem integration."
    },
    {
      "name": "Medicibe",
      "roleLabel": "Co-Founder",
      "period": "2018 — 2020",
      "summary": "Co-founded a health-tech startup; built its Android and React apps."
    },
    {
      "name": "Canesee",
      "roleLabel": "Lead Engineer",
      "period": "2019 — 2020",
      "summary": "Led 10 engineers building AI smart-glasses; ran multiple CV models concurrently on a Raspberry Pi."
    },
    {
      "name": "OSS & Freelance",
      "period": "since 2016",
      "summary": "Brought Kotlin to the Raspberry Pi (Pi4J); Simple-ADB, Rafeeq Al-Hajj, Al-Sahihan, Put-Back."
    }
  ],
  "education": [
    {
      "degree": "BSc, Computer & Systems Engineering — Zagazig University",
      "period": "2015 — 2020"
    }
  ]
}
